,sentence,background_motivation,research_method,aim_contribution_research_object,results_findings_summary
911,"Two executions are said to be diverging if the observable program behavior differs, e.g., in terms of program output, execution time, or (DNN) classification.",1,0,0,0
912,"The key challenge of differential software analysis is to simultaneously reason about multiple program paths, often across program variants.",1,0,0,0
913,"This paper presents HyDiff, the first hybrid approach for differential software analysis.",0,0,1,0
914,HyDiff integrates and extends two very successful testing techniques: Feedback-directed greybox fuzzing for efficient program testing and shadow symbolic execution for systematic program exploration.,0,0,1,0
915,HyDiff extends greybox fuzzing with divergence-driven feedback based on novel cost metrics that also take into account the control flow graph of the program.,0,0,1,0
916,Furthermore HyDiff extends shadow symbolic execution by applying four-way forking in a systematic exploration and still having the ability to incorporate concrete inputs in the analysis.,0,0,1,0
917,"HyDiff applies divergence revealing heuristics based on resource consumption and control-flow information to efficiently guide the symbolic exploration, which allows its efficient usage beyond regression testing applications.",0,0,1,0
918,"We introduce differential metrics such as output, decision and cost difference, as well as patch distance, to assist the fuzzing and symbolic execution components in maximizing the execution divergence.",0,0,0,1
919,We implemented our approach on top of the fuzzer AFL and the symbolic execution framework Symbolic PathFinder.,0,0,0,1
920,"Weillustrate HyDiff on regression and side-channel analysis for Java bytecode programs, and further show how to use HyDiff for robustness analysis of neural networks.",0,0,0,1
921,"
Database-backed web applications manipulate large amounts of persistent data, and such applications often contain constraints that restrict data length, data value, and other data properties.",1,0,0,0
922,Such constraints are critical in ensuring the reliability and usability of these applications.,1,0,0,0
923,"In this paper, we present a comprehensive study on where data constraints are expressed, what they are about, how often they evolve, and how their violations are handled.",0,0,1,0
924,"The results show that developers struggle with maintaining consistent data constraints and checking them across different components and versions of their web applications, leading to various problems.",0,0,0,1
925,"Guided by our study, we developed checking tools and API enhancements that can automatically detect such problems and improve the quality of such applications.",0,0,0,1
926,"
Many automated test generation techniques have been proposed for finding crashes in Android apps.",1,0,0,0
927,"Despite recent advancement in these approaches, a study shows that Android app developers prefer reading test cases written in natural language.",1,0,0,0
928,"Meanwhile, there exist redundancies in bug reports (written in natural language) across different apps that have not been previously reused.",1,0,0,0
929,"We propose collaborative bug finding, a novel approach that uses bugs in other similar apps to discover bugs in the app under test.",0,0,1,0
930,"We design three settings with varying degrees of interactions between programmers: (1) bugs from programmers who develop a different app, (2) bugs from manually searching for bug reports in GitHub repositories, (3) bugs from a bug recommendation system, Bugine.",0,0,1,0
931,Our studies of the first two settings in a software testing course show that collaborative bug finding helps students who are novice Android app testers to discover 17 new bugs.,0,0,0,1
932,"As students admit that searching for relevant bug reports could be time-consuming, we introduce Bugine, an approach that automatically recommends relevant GitHub issues for a given app.",0,0,0,1
933,"Bugine uses (1) natural language processing to find GitHub issues that mention common UI components shared between the app under test and other apps in our database, and (2) a ranking algorithm to select GitHub issues that are of the best quality.",0,0,0,1
934,Our results show that Bugine is able to find 34 new bugs.,0,0,0,1
935,"In total, collaborative bug finding helps us find 51 new bugs, in which eight have been confirmed and 11 have been fixed by the developers.",0,0,0,1
936,These results confirm our intuition that our proposed technique is useful in discovering new bugs for Android apps.,0,0,0,1
937,"
In recent years, machine translation software has increasingly been integrated into our daily lives.",1,0,0,0
938,"People routinely use machine translation for various applications, such as describing symptoms to a foreign doctor and reading political news in a foreign language.",1,0,0,0
939,"However, the complexity and intractability of neural machine translation (NMT) models that power modern machine translation make the robustness of these systems difficult to even assess, much less guarantee.",1,0,0,0
940,"Machine translation systems can return inferior results that lead to misunderstanding, medical misdiagnoses, threats to personal safety, or political conflicts.",1,0,0,0
941,"Despite its apparent importance, validating the robustness of machine translation systems is very difficult and has, therefore, been much under-explored.",1,0,0,0
942,"To tackle this challenge, we introduce structure-invariant testing (SIT), a novel metamorphic testing approach for validating machine translation software.",0,0,1,0
943,"Our key insight is that the translation results of ""similar"" source sentences should typically exhibit similar sentence structures.",0,0,1,0
944,"Specifically, SIT (1) generates similar source sentences by substituting one word in a given sentence with semantically similar, syntactically equivalent words; (2) represents sentence structure by syntax parse trees (obtained via constituency or dependency parsing); (3) reports sentence pairs whose structures differ quantitatively by more than some threshold.",0,0,0,1
945,"To evaluate SIT, we use it to test Google Translate and Bing Microsoft Translator with 200 source sentences as input, which led to 64 and 70 buggy issues with 69.5% and 70% top-1 accuracy, respectively.",0,1,0,1
946,"The translation errors are diverse, including under-translation, over-translation, incorrect modification, word/phrase mistranslation, and unclear logic.",0,0,0,1
947,"
Misleading names of the methods in a project or the APIs in a software library confuse developers about program functionality and API usages, leading to API misuses and defects.",1,0,0,0
948,"In this paper, we introduce MNire, a machine learning approach to check the consistency between the name of a given method and its implementation.",0,0,1,0
949,MNire first generates a candidate name and compares the current name against it.,0,0,1,0
950,"If the two names are sufficiently similar, we consider the method as consistent.",0,0,1,0
951,"To generate the method name, we draw our ideas and intuition from an empirical study on the nature of method names in a large dataset.",0,1,0,0
952,"Our key finding is that high proportions of the tokens of method names can be found in the three contexts of a given method including its body, the interface (the method's parameter types and return type), and the enclosing class' name.",0,0,0,1
953,"Even when such tokens are not there, MNire uses the contexts to predict the tokens due to the high likelihoods of their co-occurrences.",0,0,0,1
954,Our unique idea is to treat the name generation as an abstract summarization on the tokens collected from the names of the program entities in the three above contexts.,0,0,0,1
955,We conducted several experiments to evaluate MNire in method name consistency checking and in method name recommending on large datasets with +14M methods.,0,1,0,0
956,"In detecting inconsistency method names, MNire improves the state-of-the-art approach by 10.4% and 11% relatively in recall and precision, respectively.",0,0,0,1
957,"In method name recommendation, MNire improves relatively over the state-of-the-art technique, code2vec, in both recall (18.2% higher) and precision (11.1% higher).",0,0,0,1
958,"To assess MNire's usefulness, we used it to detect inconsistent methods and suggest new names in several active, GitHub projects.",0,1,0,0
959,We made 50 pull requests (PRs) and received 42 responses.,0,1,0,0
960,"Among them, five PRs were merged into the main branch, and 13 were approved for later merging.",0,0,0,1
961,"In total, in 31/42 cases, the developer teams agree that our suggested names are more meaningful than the current names, showing MNire's usefulness.",0,0,0,1
962,"
Developers build programs based on software libraries to reduce coding effort.",1,0,0,0
963,"If a program inappropriately sets an API parameter, the program may exhibit unexpected runtime behaviors.",1,0,0,0
964,"To help developers correctly use library APIs, researchers built tools to mine API parameter rules.",1,0,0,0
965,"However, it is still unknown (1) what types of parameter rules there are, and (2) how these rules distribute inside documents and source files.",1,0,0,0
966,"In this paper, we conducted an empirical study to investigate the above-mentioned questions.",0,1,1,0
967,"To analyze as many parameter rules as possible, we took a hybrid approach that combines automatic localization of constrained parameters with manual inspection.",0,1,0,0
968,"Our automatic approach---PaRu---locates parameters that have constraints either documented in Javadoc (i.e., document rules) or implied by source code (i.e., code rules).",0,1,0,0
969,"Our manual inspection (1) identifies and categorizes rules for the located parameters, and (2) establishes mapping between document and code rules.",0,0,0,1
970,"By applying PaRu to 9 widely used libraries, we located 5,334 parameters with either document or code rules.",0,0,0,1
971,"Interestingly, there are only 187 parameters that have both types of rules, and 79 pairs of these parameter rules are unmatched.",0,0,0,1
972,"Additionally, PaRu extracted 1,688 rule sentences from Javadoc and code.",0,0,0,1
973,"We manually classified these sentences into six categories, two of which are overlooked by prior approaches.",0,0,0,1
974,We found that 86.2% of parameters have only code rules; 10.3% of parameters have only document rules; and only 3.5% of parameters have both document and code rules.,0,0,0,1
975,Our research reveals the challenges for automating parameter rule extraction.,0,0,0,1
976,"Based on our findings, we discuss the potentials of prior approaches and present our insights for future tool design.",0,0,0,1
977,"
The number of vulnerabilities increases rapidly in recent years, due to advances in vulnerability discovery solutions.",1,0,0,0
978,It enables a thorough analysis on the vulnerability distribution and provides support for correlation analysis and prediction of vulnerabilities.,1,0,0,0
979,"Previous research either focuses on analyzing bugs rather than vulnerabilities, or only studies general vulnerability distribution among projects rather than the distribution within each project.",1,0,0,0
980,"In this paper, we collected a large vulnerability dataset, consisting of all known vulnerabilities associated with five representative open source projects, by utilizing automated crawlers and spending months of manual efforts.",0,0,1,0
981,"We then analyzed the vulnerability distribution within each project over four dimensions, including files, functions, vulnerability types and responsible developers.",0,0,1,0
982,"Based on the results analysis, we presented 12 practical insights on the distribution of vulnerabilities.",0,0,0,1
983,"Finally, we applied such insights on several vulnerability discovery solutions (including static analysis and dynamic fuzzing), and helped them find 10 zero-day vulnerabilities in target projects, showing that our insights are useful.",0,0,0,1
984,"
Test-to-code traceability links model the relationships between test artefacts and code artefacts.",1,0,0,0
985,"When utilised during the development process, these links help developers to keep test code in sync with tested code, reducing the rate of test failures and missed faults.",1,0,0,0
986,"Test-to-code traceability links can also help developers to maintain an accurate mental model of the system, reducing the risk of architectural degradation when making changes.",1,0,0,0
987,"However, establishing and maintaining these links manually places an extra burden on developers and is error-prone.",1,0,0,0
988,"This paper presents TCtracer, an approach and implementation for the automatic establishment of test-to-code traceability links.",0,0,1,0
989,"Unlike existing work, TCtracer operates at both the method level and the class level, allowing us to establish links between tests and functions, as well as between test classes and tested classes.",0,0,1,0
990,We improve over existing techniques by combining an ensemble of new and existing techniques and exploiting a synergistic flow of information between the method and class levels.,0,0,1,0
991,"An evaluation of TCtracer using four large, well-studied open source systems demonstrates that, on average, we can establish test-to-function links with a mean average precision (MAP) of 78% and test-class-to-class links with an MAP of 93%.",0,0,0,1
992,"
Large-scale open source communities, such as the Linux kernel, have gone through decades of development, substantially growing in scale and complexity.",1,0,0,0
993,"In the traditional workflow, maintainers serve as ""gatekeepers"" for the subsystems that they maintain.",1,0,0,0
994,"As the number of patches and authors significantly increases, maintainers come under considerable pressure, which may hinder the operation and even the sustainability of the community.",1,0,0,0
995,A few subsystems have begun to use new workflows to address these issues.,1,0,0,0
996,"However, it is unclear to what extent these new workflows are successful, or how to apply them.",1,0,0,0
997,"Therefore, we conduct an empirical study on the multiple-committer model (MCM) that has provoked extensive discussion in the Linux kernel community.",0,0,1,0
998,"We explore the effect of the model on the i915 subsystem with respect to four dimensions: pressure, latency, complexity, and quality assurance.",0,0,1,0
999,"We find that after this model was adopted, the burden of the i915 maintainers was significantly reduced.",0,0,0,1
1000,"Also, the model scales well to allow more committers.",0,0,0,1
1001,"After analyzing the online documents and interviewing the maintainers of i915, we propose that overloaded subsystems which have trustworthy candidate committers are suitable for adopting the model.",0,0,0,1
1002,"We further suggest that the success of the model is closely related to a series of measures for risk mitigation---sufficient precommit testing, strict review process, and the use of tools to simplify work and reduce errors.",0,0,0,1
1003,We employ a network analysis approach to locate candidate committers for the target subsystems and validate this approach and contextual success factors through email interviews with their maintainers.,0,1,0,0
1004,"To the best of our knowledge, this is the first study focusing on how to scale open source communities.",0,1,0,0
1005,We expect that our study will help the rapidly growing Linux kernel and other similar communities to adapt to changes and remain sustainable.,0,0,0,1
1006,Static analysis is increasingly used by companies and individual code developers to detect and fix bugs and security vulnerabilities.,1,0,0,0
1007,"As programs grow more complex, the analyses have to support new code concepts, frameworks and libraries.",1,0,0,0
1008,"However, static-analysis code itself is also prone to bugs.",1,0,0,0
1009,"While more complex analyses are written and used in production systems every day, the cost of debugging and fixing them also increases tremendously.",1,0,0,0
1010,"To understand the difficulties of debugging static analysis, we surveyed 115 static-analysis writers.",0,1,1,0
1011,"From their responses, we determined the core requirements to build a debugger for static analyses, which revolve around two main issues: abstracting from both the analysis code and the code it analyses at the same time, and tracking the analysis internal state throughout both code bases.",0,0,0,1
1012,Most tools used by our survey participants lack the capabilities to address both issues.,0,0,0,1
1013,"Focusing on those requirements, we introduce Visuflow, a debugging environment for static data-flow analysis.",0,0,1,0
1014,Visuflow features graph visualizations and custom breakpoints that enable users to view the state of an analysis at any time.,0,0,1,0
1015,"In a user study on 20 static-analysis writers, Visuflow helped identify 25 and fix 50 percent more errors in the analysis code compared to the standard Eclipse debugging environment.",0,1,0,1
1016,Selecting reviewers for code changes is a critical step for an efficient code review process.,1,0,0,0
1017,Recent studies propose automated reviewer recommendation algorithms to support developers in this task.,1,0,0,0
1018,"However, the evaluation of recommendation algorithms, when done apart from their target systems and users (i.e., code review tools and change authors), leaves out important aspects: perception of recommendations, influence of recommendations on human choices, and their effect on user experience.",1,0,0,0
1019,This study is the first to evaluate a reviewer recommender in vivo.,0,0,1,0
1020,"We compare historical reviewers and recommendations for over 21,000 code reviews performed with a deployed recommender in a company environment and set out to measure the influence of recommendations on users' choices, along with other performance metrics.",0,1,0,0
1021,"Having found no evidence of influence, we turn to the users of the recommender.",0,0,0,1
1022,"Through interviews and a survey we find that, though perceived as relevant, reviewer recommendations rarely provide additional value for the respondents.",0,1,0,1
1023,We confirm this finding with a larger study at another company.,0,0,0,1
1024,The confirmation of this finding brings up a case for more user-centric approaches to designing and evaluating the recommenders.,0,0,0,1
1025,"Finally, we investigate information needs of developers during reviewer selection and discuss promising directions for the next generation of reviewer recommendation tools.",0,0,1,0
1026,Abbreviations are widely used in identifiers.,1,0,0,0
1027,"However, they have severe negative impact on program comprehension and IR-based software maintenance activities, e.g., concept location, software clustering, and recovery of traceability links.",1,0,0,0
1028,"Consequently, a number of efficient approaches have been proposed successfully to expand abbreviations in identifiers.",1,0,0,0
1029,"Most of such approaches rely heavily on dictionaries, and rarely exploit the specific and fine-grained context of identifiers.",1,0,0,0
1030,"As a result, such approaches are less accurate in expanding abbreviations (especially short ones) that may match multiple dictionary words.",1,0,0,0
1031,"To this end, in this paper we propose an automatic approach to improve the accuracy of abbreviation expansion by exploiting the specific and fine-grained context.",0,0,1,0
1032,"It focuses on a special but common category of abbreviations (abbreviations in parameter names), and thus it can exploit the specific and fine-grained context, i.e., the type of the enclosing parameter as well the corresponding formal (or actual) parameter name.",0,0,1,0
1033,The recent empirical study on parameters suggest that actual parameters are often lexically similar to their corresponding formal parameters.,0,1,0,0
1034,"Consequently, it is likely that an abbreviation in a formal parameter can find its full terms in the corresponding actual parameter, and vice versa.",0,0,1,0
1035,"Based on this assumption, a series of heuristics are proposed to look for full terms from the corresponding actual (or formal) parameter names.",0,1,0,0
1036,"To the best of our knowledge, we are the first to expand abbreviations by exploiting the lexical similarity between actual and formal parameters.",0,1,0,0
1037,We also search for full terms in the data type of the enclosing parameter.,0,0,1,0
1038,"Only if all such heuristics fail, the approach turns to the traditional abbreviation dictionaries.",0,0,1,0
1039,We evaluate the proposed approach on seven well known open-source projects.,0,1,0,0
1040,"Evaluation results suggest that when only parameter abbreviations are involved, the proposed approach can improve the precision from 26 to 95 percent and recall from 26 to 65 percent compared against the state-of-the-art general purpose approach.",0,0,0,1
1041,"Consequently, the proposed approach could be employed as a useful supplement to existing approaches to expand parameter abbreviations.",0,0,0,1
1042,Test adequacy criteria are widely used to guide test creation.,1,0,0,0
1043,"However, many of these criteria are sensitive to statement structure or the choice of test oracle.",1,0,0,0
1044,"This is because such criteria ensure that execution reaches the element of interest, but impose no constraints on the execution path after this point.",1,0,0,0
1045,We are not guaranteed to observe a failure just because a fault is triggered.,1,0,0,0
1046,"To address this issue, we have proposed the concept of observability-an extension to coverage criteria based on Boolean expressions that combines the obligations of a host criterion with an additional path condition that increases the likelihood that a fault encountered will propagate to a monitored variable.",0,0,1,0
1047,"Our study, conducted over five industrial systems and an additional forty open-source systems, has revealed that adding observability tends to improve efficacy over satisfaction of the traditional criteria, with average improvements of 125.98 percent in mutation detection with the common output-only test oracle and per-model improvements of up to 1760.52 percent.",0,1,0,1
1048,"Ultimately, there is merit to our hypothesis-observability reduces sensitivity to the choice of oracle and to the program structure.",0,0,0,1
1049,"We present Supa, a value-flow-based demand-driven flow- and context-sensitive pointer analysis with strong updates for C and C++ programs.",0,0,1,0
1050,"Supa enables computing points-to information via value-flow refinement, in environments with small time and memory budgets.",0,0,1,0
1051,"We formulate Supa by solving a graph-reachability problem on an inter-procedural value-flow graph representing a program's def-use chains, which are pre-computed efficiently but over-approximately.",0,0,1,0
1052,"To answer a client query (a request for a variable's points-to set), Supa reasons about the flow of values along the pre-computed def-use chains sparsely (rather than across all program points), by performing only the work necessary for the query (rather than analyzing the whole program).",0,0,1,0
1053,"In particular, strong updates are performed to filter out spurious def-use chains through value-flow refinement as long as the total budget is not exhausted.",0,0,1,0
1054,"We have implemented Supa on top of LLVM (4.0.0) together with a comprehensive micro-benchmark suite after a years-long effort (consisting of around 400 test cases, including hand-written ones and the ones extracted from real programs).",0,0,1,0
1055,"We have evaluated Supa by choosing uninitialized pointer detection and C++ virtual table resolution as two major clients, using 24 real-world programs including 18 open-source C programs and 6 large CPU2000/2006 C++ benchmarks.",0,1,0,0
1056,"For uninitialized pointer client, Supa achieves improved precision as the analysis budget increases, with its flow-sensitive (context-insensitive) analysis reaching 97.4 percent of that achieved by whole-program Sparse Flow-Sensitive analysis (SFS) by consuming about 0.18 seconds and 65 KB of memory per query, on average (with a budget of at most 10,000 value-flow edges per query).",0,0,0,1
1057,"With context-sensitivity also considered, Supa becomes more precise for some programs but also incurs more analysis times.",0,0,0,1
1058,"To further demonstrate the effectiveness of Supa, we have also evaluated Supa in resolving C++ virtual tables by querying the function pointers at every virtual callsite.",0,1,0,0
1059,"Compared to analysis without strong updates for heap objects, Supa's demand-driven context-sensitive strong update analysis reduces 7.35 percent spurious virtual table targets with only 0.4 secs per query, on average.",0,0,0,1
1060,"Developers always focus on delivering high-quality updates to improve, or maintain the rating of their apps.",1,0,0,0
1061,Prior work has studied user reviews by analyzing all reviews of an app.,1,0,0,0
1062,"However, this app-level analysis misses the point that users post reviews to provide their feedback on a certain update.",1,0,0,0
1063,"For example, two bad updates of an app with a history of good updates would not be spotted using app-level analysis.",1,0,0,0
1064,"In this paper, we examine reviews at the update-level to better understand how users perceive bad updates.",0,0,1,0
1065,"We focus our study on the top 250 bad updates (i.e., updates with the highest increase in the percentage of negative reviews relative to the prior updates of the app) from 26,726 updates of 2,526 top free-to-download apps in the Google Play Store.",0,1,0,0
1066,We find that feature removal and UI issues have the highest increase in the percentage of negative reviews.,0,0,0,1
