,sentence,background_motivation,research_method,aim_contribution_research_object,results_findings_summary
458,"Lastly, our study finds several cases where developers claim they ""fixed"" a flaky test but our empirical experiments show that their changes do not fix or reduce these tests' frequency of flaky-test failures.",0,1,0,0
459,"Future studies should be more cautious when basing their results on changes that developers claim to be ""fixes"".",0,0,0,1
460,"
Metamodels play a significant role to describe and analyze the relations between domain concepts.",1,0,0,0
461,They are also cornerstone to build a software language (SL) for a domain and its associated tooling.,1,0,0,0
462,Metamodel definition generally drives code generation of a core API.,1,0,0,0
463,"The latter is further enriched by developers with additional code implementing advanced functionalities, e.g., checkers, recommenders, etc. When a SL is evolved to the next version, the metamodels are evolved as well before to re-generate the core API code.",1,0,0,0
464,"As a result, the developers added code both in the core API and the SL toolings may be impacted and thus may need to be co-evolved accordingly.",1,0,0,0
465,Many approaches support the co-evolution of various artifacts when metamodels evolve.,1,0,0,0
466,"However, not the co-evolution of code.",1,0,0,0
467,This paper fills this gap.,0,0,1,0
468,We propose a semi-automatic co-evolution approach based on change propagation.,0,0,1,0
469,The premise is that knowledge of the metamodel evolution changes can be propagated by means of resolutions to drive the code co-evolution.,0,0,1,0
470,Our approach leverages on the abstraction level of metamodels where a given metamodel element has often different usages in the code.,0,0,1,0
471,It supports alternative co-evaluations to meet different developers needs.,0,0,1,0
472,"Our work is evaluated on three Eclipse SL implementations, namely OCL, Modisco, and Papyrus over several evolved versions of metamodels and code.",0,1,0,0
473,"In response to five different evolved metamodels, we co-evolved 976 impacts over 18 projects.A comparison of our co-evolved code with the versioned ones shows the usefulness of our approach.",0,0,0,1
474,Our approach was able to reach a weighted average of 87.4% and 88.9% respectively of precision and recall while supporting useful alternative co-evolution that developers have manually performed.,0,0,0,1
475,"
Developer turnover is inevitable on software projects and leads to knowledge loss, a reduction in productivity, and an increase in defects.",1,0,0,0
476,Mitigation strategies to deal with turnover tend to disrupt and increase workloads for developers.,1,0,0,0
477,"In this work, we suggest that through code review recommendation we can distribute knowledge and mitigate turnover with minimal impacton the development process.",0,0,1,0
478,"We evaluate review recommenders in the context of ensuring expertise during review, Expertise, reducing the review workload of the core team, CoreWorkload, and reducing the Files at Risk to turnover, FaR.",0,1,0,0
479,We find that prior work that assigns reviewers based on file ownership concentrates knowledge on a small group of core developers increasing risk of knowledge loss from turnover by up to 65%.,0,0,0,1
480,We propose learning and retention aware review recommenders that when combined are effective at reducing the risk of turnover by -29% but they unacceptably reduce the overall expertise during reviews by -26%.,0,0,0,1
481,"We develop the Sofia recommender that suggests experts when none of the files under review are hoarded by developers, but distributes knowledge when files are at risk.",0,0,1,0
482,"In this way, we are able to simultaneously increase expertise during review with a ΔExpertise of 6%, with a negligible impact on workload of ΔCoreWorkload of 0.09%, and reduce the files at risk by ΔFaR -28%.",0,0,0,1
483,"Sofia is integrated into GitHub pull requests allowing developers to select an appropriate expert or ""learner"" based on the context of the review.",0,0,0,1
484,We release the Sofia bot as well as the code and data for replication purposes.,0,0,0,1
485,"
Context: Following on other scientific disciplines, such as health sciences, the use of Grey Literature (GL) has become widespread in Software Engineering (SE) research.",1,0,0,0
486,"Whilst the number of papers incorporating GL in SE is increasing, there is little empirically known about different aspects of the use of GL in SE research.",1,0,0,0
487,Method: We used a mixed-methods approach for this research.,0,1,0,0
488,"We carried out a Systematic Literature Review (SLR) of the use of GL in SE, and surveyed the authors of the selected papers included in the SLR (as GL users) and the invited experts in SE community on the use of GL in SE research.",0,1,0,0
489,"Results: We systematically selected and reviewed 102 SE secondary studies that incorporate GL in SE research, from which we identified two groups based on their reporting: 1) 76 reviews only claim their use of GL; 2) 26 reviews report the results by including GL.",0,0,0,1
490,We also obtained 20 replies from the GL users and 24 replies from the invited SE experts.,0,0,0,1
491,Conclusion: There is no common understanding of the meaning of GL in SE.,0,0,0,1
492,Researchers define the scopes and the definitions of GL in a variety of ways.,0,0,0,1
493,We found five main reasons of using GL in SE research.,0,0,0,1
494,The findings have enabled us to propose a conceptual model for how GL works in SE research lifecycle.,0,0,0,1
495,There is an apparent need for research to develop guidelines for using GL in SE and for assessing quality of GL.,0,0,0,1
496,"The current work can provide a panorama of the state-of-the-art of using GL in SE for the follow-up research, as to determine the important position of GL in SE research.",0,0,0,1
497,"
Performance is one of the important aspects of software quality.",1,0,0,0
498,"Performance issues exist widely in software systems, and the process of fixing the performance issues is an essential step in the release cycle of software systems.",1,0,0,0
499,"Although performance testing is widely adopted in practice, it is still expensive and time-consuming.",1,0,0,0
500,"In particular, the performance testing is usually conducted after the system is built in a dedicated testing environment.",1,0,0,0
501,The challenges of performance testing make it difficult to fit into the common DevOps process in software development.,1,0,0,0
502,"On the other hand, there exist a large number of tests readily available, that are executed regularly within the release pipeline during software development.",1,0,0,0
503,"In this paper, we perform an exploratory study to determine whether such readily available tests are capable of serving as performance tests.",0,0,1,0
504,"In particular, we would like to see whether the performance of these tests can demonstrate performance improvements obtained from fixing real-life performance issues.",0,0,1,0
505,"We collect 127 performance issues from Hadoop and Cassandra, and evaluate the performance of the readily available tests from the commits before and after the performance issue fixes.",0,1,0,0
506,We find that most of the improvements from the fixes to performance issues can be demonstrated using the readily available tests in the release pipeline.,0,0,0,1
507,"However, only a very small portion of the tests can be used for demonstrating the improvements.",0,0,0,1
508,"By manually examining the tests, we identify eight reasons that a test cannot demonstrate performance improvements even though it covers the changed source code of the issue fix.",0,0,0,1
509,"Finally, we build random forest classifiers determining the important metrics influencing the readily available tests (not) being able to demonstrate performance improvements from issue fixes.",0,0,0,1
510,"We find that the test code itself and the source code covered by the test are important factors, while the factors related to the code changes in the performance issues fixes have a low importance.",0,0,0,1
511,"Practitioners may focus on designing and improving the tests, instead of fine-tuning tests for different performance issues fixes.",0,0,0,1
512,Our findings can be used as a guideline for practitioners to reduce the amount of effort spent on leveraging and designing tests that run in the release pipeline for performance assurance activities.,0,0,0,1
513,"
Recurrent Neural Networks (RNN) can deal with (textual) input with various length and hence have a lot of applications in software systems and software engineering applications.",1,0,0,0
514,RNNs depend on word embeddings that are usually pre-trained by third parties to encode textual inputs to numerical values.,1,0,0,0
515,It is well known that problematic word embeddings can lead to low model accuracy.,1,0,0,0
516,"In this paper, we propose a new technique to automatically diagnose how problematic embeddings impact model performance, by comparing model execution traces from correctly and incorrectly executed samples.",0,0,1,0
517,We then leverage the diagnosis results as guidance to harden/repair the embeddings.,0,0,1,0
518,"Our experiments show that TRADER can consistently and effectively improve accuracy for real world models and datasets by 5.37% on average, which represents substantial improvement in the literature of RNN models.",0,0,0,1
519,"
Mobile apps are an integral component of our daily life.",1,0,0,0
520,"Ability to use mobile apps is important for everyone, but arguably even more so for approximately 15% of the world population with disabilities.",1,0,0,0
521,This paper presents the results of a large-scale empirical study aimed at understanding accessibility of Android apps from three complementary perspectives.,0,0,1,0
522,"First, we analyze the prevalence of accessibility issues in over 1, 000 Android apps.",0,1,0,0
523,"We find that almost all apps are riddled with accessibility issues, hindering their use by disabled people.",0,0,0,1
524,We then investigate the developer sentiments through a survey aimed at understanding the root causes of so many accessibility issues.,0,1,0,0
525,"We find that in large part developers are unaware of accessibility design principles and analysis tools, and the organizations in which they are employed do not place a premium on accessibility.",0,0,0,1
526,We finally investigate user ratings and comments on app stores.,0,1,0,0
527,"We find that due to the disproportionately small number of users with disabilities, user ratings and app popularity are not indicative of the extent of accessibility issues in apps.",0,0,0,1
528,We conclude the paper with several observations that form the foundation for future research and development.,0,0,0,1
529,"
Existing coverage-based fuzzers usually use the individual control flow graph (CFG) edge coverage to guide the fuzzing process, which has shown great potential in finding vulnerabilities.",1,0,0,0
530,"However, CFG edge coverage is not effective in discovering vulnerabilities such as use-after-free (UaF).",1,0,0,0
531,"This is because, to trigger UaF vulnerabilities, one needs not only to cover individual edges, but also to traverse some (long) sequence of edges in a particular order, which is challenging for existing fuzzers.",1,0,0,0
532,"To this end, we propose to model UaF vulnerabilities as typestate properties, and develop a typestate-guided fuzzer, named UAFL, for discovering vulnerabilities violating typestate properties.",0,0,1,0
533,"Given a typestate property, we first perform a static typestate analysis to find operation sequences potentially violating the property.",0,1,0,0
534,Our fuzzing process is then guided by the operation sequences in order to progressively generate test cases triggering property violations.,0,1,0,0
535,"In addition, we also employ an information flow analysis to improve the efficiency of the fuzzing process.",0,1,0,0
536,We have performed a thorough evaluation of UAFL on 14 widely-used real-world programs.,0,1,0,0
537,"The experiment results show that UAFL substantially outperforms the state-of-the-art fuzzers, including AFL, AFLFast, FairFuzz, MOpt, Angora and QSYM, in terms of the time taken to discover vulnerabilities.",0,0,0,1
538,"We have discovered 10 previously unknown vulnerabilities, and received 5 new CVEs.",0,0,0,1
539,"
Merge conflicts are inevitable in collaborative software development and are disruptive.",1,0,0,0
540,"When they occur, developers have to stop their current work, understand the conflict and the surrounding code, and plan an appropriate resolution.",1,0,0,0
541,"However, not all conflicts are equally problematic---some can be easily fixed, while others might be complicated enough to need multiple people.",1,0,0,0
542,"Currently, there is not much support to help developers plan their conflict resolution.",1,0,0,0
543,"In this work, we aim to predict the difficulty of a merge conflict so as to help developers plan their conflict resolution.",0,0,1,0
544,The ability to predict the difficulty of a merge conflict and to identify the underlying factors for its difficulty can help tool builders improve their conflict detection tools to prioritize and warn developers of difficult conflicts.,1,0,0,0
545,"In this work, we investigate the characteristics of difficult merge conflicts, and automatically classify them.",0,0,1,0
546,"We analyzed 6,380 conflicts across 128 java projects and found that merge conflict difficulty can be accurately predicted (AUC of 0.76) through machine learning algorithms, such as bagging.",0,1,0,1
547,"
Generating high-quality system call sequences is not only important to testing file system implementations, but also challenging due to the astronomically large input space.",1,0,0,0
548,This paper introduces a new approach to the workload generation problem by building layered models and abstract workloads refinement.,0,0,1,0
549,This approach is instantiated as a three-layer file system model for file system workload generation.,0,0,1,0
550,"In a short-period experiment run, sequential workloads (system call sequences) manifested over a thousand crashes in mainline Linux Kernel file systems, with 12 previously unknown bugs being reported.",0,1,0,0
551,We also provide evidence that such workloads benefit other domain-specific testing techniques including crash consistency testing and concurrency testing.,0,0,0,1
552,"
Significant interest in applying Deep Neural Network (DNN) has fueled the need to support engineering of software that uses DNNs.",1,0,0,0
553,"Repairing software that uses DNNs is one such unmistakable SE need where automated tools could be beneficial; however, we do not fully understand challenges to repairing and patterns that are utilized when manually repairing DNNs.",1,0,0,0
554,What challenges should automated repair tools address?,1,0,0,0
555,What are the repair patterns whose automation could help developers?,1,0,0,0
556,Which repair patterns should be assigned a higher priority for building automated bug repair tools?,1,0,0,0
557,This work presents a comprehensive study of bug fix patterns to address these questions.,0,0,1,0
558,"We have studied 415 repairs from Stack Overflow and 555 repairs from GitHub for five popular deep learning libraries Caffe, Keras, Tensorflow, Theano, and Torch to understand challenges in repairs and bug repair patterns.",0,1,0,0
559,"Our key findings reveal that DNN bug fix patterns are distinctive compared to traditional bug fix patterns; the most common bug fix patterns are fixing data dimension and neural network connectivity; DNN bug fixes have the potential to introduce adversarial vulnerabilities; DNN bug fixes frequently introduce new bugs; and DNN bug localization, reuse of trained model, and coping with frequent releases are major challenges faced by developers when fixing bugs.",0,0,0,1
560,"We also contribute a benchmark of 667 DNN (bug, repair) instances.",0,0,0,1
561,"
Modern static analyzers often need to simultaneously check a few dozen or even hundreds of value-flow properties, causing serious scalability issues when high precision is required.",1,0,0,0
562,"A major factor to this deficiency, as we observe, is that the core static analysis engine is oblivious of the mutual synergy among the properties being checked, thus inevitably losing many optimization opportunities.",1,0,0,0
563,Our work is to leverage the inter-property awareness and to capture redundancies and inconsistencies when many properties are considered at the same time.,0,0,1,0
564,We have evaluated our approach by checking twenty value-flow properties in standard benchmark programs and ten real-world software systems.,0,1,0,0
565,The results demonstrate that our approach is more than 8× faster than existing ones but consumes only 1/7 of the memory.,0,0,0,1
566,"Such substantial improvement in analysis efficiency is not achieved by sacrificing the effectiveness: at the time of writing, thirty-nine bugs found by our approach have been fixed by developers and four of them have been assigned CVE IDs due to their security impact.",0,0,0,1
567,"
This paper presents TransRepair, a fully automatic approach for testing and repairing the consistency of machine translation systems.",0,0,1,0
568,TransRepair combines mutation with metamorphic testing to detect inconsistency bugs (without access to human oracles).,0,0,1,0
569,"It then adopts probability-reference or cross-reference to post-process the translations, in a grey-box or black-box manner, to repair the inconsistencies.",0,0,1,0
570,"Our evaluation on two state-of-the-art translators, Google Translate and Transformer, indicates that TransRepair has a high precision (99%) on generating input pairs with consistent translations.",0,1,0,1
571,"With these tests, using automatic consistency metrics and manual assessment, we find that Google Translate and Transformer have approximately 36% and 40% inconsistency bugs.",0,1,0,1
572,Black-box repair fixes 28% and 19% bugs on average for Google Translate and Transformer.,0,0,0,1
573,Grey-box repair fixes 30% bugs on average for Transformer.,0,0,0,1
574,"Manual inspection indicates that the translations repaired by our approach improve consistency in 87% of cases (degrading it in 2%), and that our repairs have better translation acceptability in 27% of the cases (worse in 8%).",0,0,0,1
575,"
In contemporary code review, the comments put by reviewers on a specific code change are immediately visible to the other reviewers involved.",1,0,0,0
576,"Could this visibility prime new reviewers' attention (due to the human's proneness to availability bias), thus biasing the code review outcome?",1,0,0,0
577,"In this study, we investigate this topic by conducting a controlled experiment with 85 developers who perform a code review and a psychological experiment.",0,1,1,0
578,"With the psychological experiment, we find that ≈70% of participants are prone to availability bias.",0,1,0,1
579,"However, when it comes to the code review, our experiment results show that participants are primed only when the existing code review comment is about a type of bug that is not normally considered; when this comment is visible, participants are more likely to find another occurrence of this type of bug.",0,0,0,1
580,"Moreover, this priming effect does not influence reviewers' likelihood of detecting other types of bugs.",0,0,0,1
581,"Our findings suggest that the current code review practice is effective because existing review comments about bugs in code changes are not negative primers, rather positive reminders for bugs that would otherwise be overlooked during code review.",0,0,0,1
582,"
Many data-driven software engineering tasks such as discovering programming patterns, mining API specifications, etc., perform source code analysis over control flow graphs (CFGs) at scale.",1,0,0,0
583,Analyzing millions of CFGs can be expensive and performance of the analysis heavily depends on the underlying CFG traversal strategy.,1,0,0,0
584,State-of-the-art analysis frameworks use a fixed traversal strategy.,1,0,0,0
585,We argue that a single traversal strategy does not fit all kinds of analyses and CFGs and propose bespoke control flow analysis (BCFA).,0,0,1,0
586,"Given a control flow analysis (CFA) and a large number of CFGs, BCFA selects the most efficient traversal strategy for each CFG.",1,0,0,0
587,"BCFA extracts a set of properties of the CFA by analyzing the code of the CFA and combines it with properties of the CFG, such as branching factor and cyclicity, for selecting the optimal traversal strategy.",0,0,0,1
588,"We have implemented BCFA in Boa, and evaluated BCFA using a set of representative static analyses that mainly involve traversing CFGs and two large datasets containing 287 thousand and 162 million CFGs.",0,1,0,0
589,Our results show that BCFA can speedup the large scale analyses by 1%-28%.,0,0,0,1
590,"Further, BCFA has low overheads; less than 0.2%, and low misprediction rate; less than 0.01%.",0,0,0,1
591,"
Grey-box fuzzing is an evolutionary process, which maintains and evolves a population of test cases with the help of a fitness function.",1,0,0,0
592,Fitness functions used by current grey-box fuzzers are not informative in that they cannot distinguish different program executions as long as those executions achieve the same coverage.,1,0,0,0
593,"The problem is that current fitness functions only consider a union of data, but not their combination.",1,0,0,0
594,"As such, fuzzers often get stuck in a local optimum during their search.",1,0,0,0
595,"In this paper, we introduce Ankou, the first grey-box fuzzer that recognizes different combinations of execution information, and present several scalability challenges encountered while designing and implementing Ankou.",0,0,1,0
596,"Our experimental results show that Ankou is 1.94× and 8.0× more effective in finding bugs than AFL and Angora, respectively.",0,0,0,1
597,"
Bottom-up program analysis has been traditionally easy to parallelize because functions without caller-callee relations can be analyzed independently.",1,0,0,0
598,"However, such function-level parallelism is significantly limited by the calling dependence - functions with caller-callee relations have to be analyzed sequentially because the analysis of a function depends on the analysis results, a.k.a., function summaries, of its callees.",1,0,0,0
599,"We observe that the calling dependence can be relaxed in many cases and, as a result, the parallelism can be improved.",1,0,0,0
600,"In this paper, we present Coyote, a framework of bottom-up data flow analysis, in which the analysis task of each function is elaborately partitioned into multiple sub-tasks to generate pipelineable function summaries.",0,0,1,0
601,"These sub-tasks are pipelined and run in parallel, even though the calling dependence exists.",0,0,1,0
602,We formalize our idea under the IFDS/IDE framework and have implemented an application to checking null-dereference bugs and taint issues in C/C++ programs.,0,0,1,0
603,"We evaluate Coyote on a series of standard benchmark programs and open-source software systems, which demonstrates significant speedup over a conventional parallel design.",0,1,0,1
604,"
Static analysis is a proven technique for catching bugs during software development.",1,0,0,0
605,"However, analysis tooling must approximate, both theoretically and in the interest of practicality.",1,0,0,0
606,False positives are a pervading manifestation of such approximations---tool configuration and customization is therefore crucial for usability and directing analysis behavior.,1,0,0,0
607,"To suppress false positives, developers readily disable bug checks or insert comments that suppress spurious bug reports.",1,0,0,0
608,Existing work shows that these mechanisms fall short of developer needs and present a significant pain point for using or adopting analyses.,1,0,0,0
609,We draw on the insight that an analysis user always has one notable ability to influence analysis behavior regardless of analyzer options and implementation: modifying their program.,1,0,0,0
610,"We present a new technique for automated, generic, and temporary code changes that tailor to suppress spurious analysis errors.",0,0,1,0
611,"We adopt a rule-based approach where simple, declarative templates describe general syntactic changes for code patterns that are known to be problematic for the analyzer.",0,1,0,0
612,Our technique promotes program transformation as a general primitive for improving the fidelity of analysis reports (we treat any given analyzer as a black box).,0,1,0,0
613,"We evaluate using five different static analyzers supporting three different languages (C, Java, and PHP) on large, real world programs (up to 800KLOC).",0,1,0,0
614,We show that our approach is effective in sidestepping long-standing and complex issues in analysis implementations.,0,0,0,1
615,"
As Android platform evolves in a fast pace, API-related compatibility issues become a significant challenge for developers.",1,0,0,0
616,"To handle an incompatible API invocation, developers mainly have two choices: merely performing sufficient checks to avoid invoking incompatible APIs on platforms that do not support them, or gracefully providing replacement implementations on those incompatible platforms.",1,0,0,0
617,"As providing more consistent app behaviors, the latter one is more recommended and more challenging to adopt.",1,0,0,0
618,"However, it is still unknown how these issues are handled in the real world, do developers meet difficulties and what can we do to help them.",1,0,0,0
619,"In light of this, this paper performs the first large-scale study on the current practice of handling evolution-induced API compatibility issues in about 300,000 Android market apps, and more importantly, their solutions (if exist).",0,1,1,0
