,sentence,background_motivation,research_method,aim_contribution_research_object,results_findings_summary
1514,"
Keeping a good influx of newcomers is critical for open source software projects' survival, while newcomers face many barriers to contributing to a project for the first time.",1,0,0,0
1515,"To support newcomers onboarding, GitHub encourages projects to apply labels such as good first issue (GFI) to tag issues suitable for newcomers.",1,0,0,0
1516,"However, many newcomers still fail to contribute even after many attempts, which not only reduces the enthusiasm of newcomers to contribute but makes the efforts of project members in vain.",1,0,0,0
1517,"To better support the onboarding of newcomers, this paper reports a preliminary study on this mechanism from its application status, effect, problems, and best practices.",0,0,1,0
1518,"By analyzing 9,368 GFIs from 816 popular GitHub projects and conducting email surveys with newcomers and project members, we obtain the following results.",0,1,0,0
1519,"We find that more and more projects are applying this mechanism in the past decade, especially the popular projects.",0,0,0,1
1520,"Compared to common issues, GFIs usually need more days to be solved.",0,0,0,1
1521,"While some newcomers really join the projects through GFIs, almost half of GFIs are not solved by newcomers.",0,0,0,1
1522,"We also discover a series of problems covering mechanism (e.g., inappropriate GFIs), project (e.g., insufficient GFIs) and newcomer (e.g., uneven skills) that makes this mechanism ineffective.",0,0,0,1
1523,"We discover the practices that may address the problems, including identifying GFIs that have informative description and available support, and require limited scope and skill, etc. Newcomer onboarding is an important but challenging question in open source projects and our work enables a better understanding of GFI mechanism and its problems, as well as highlights ways in improving them.",0,0,0,1
1524,"
Loop invariant generation has long been a challenging problem.",1,0,0,0
1525,Black-box learning has recently emerged as a promising method for inferring loop invariants.,1,0,0,0
1526,"However, the performance depends heavily on the quality of collected examples.",1,0,0,0
1527,"In many cases, only after tens or even hundreds of constraint queries, can a feasible invariant be successfully inferred.",1,0,0,0
1528,"To reduce the gigantic number of constraint queries and improve the performance of black-box learning, we introduce interval counterexamples into the learning framework.",0,0,1,0
1529,Each interval counterexample represents a set of counterexamples from constraint solvers.,0,0,0,1
1530,We propose three different generalization techniques to compute interval counterexamples.,0,0,0,1
1531,The existing decision tree algorithm is also improved to adapt interval counterexamples.,0,0,0,1
1532,We evaluate our techniques and report over 40% improvement on learning rounds and verification time over the state-of-the-art approach.,0,0,0,1
1533,"
Machine translation software has become heavily integrated into our daily lives due to the recent improvement in the performance of deep neural networks.",1,0,0,0
1534,"However, machine translation software has been shown to regularly return erroneous translations, which can lead to harmful consequences such as economic loss and political conflicts.",1,0,0,0
1535,"Additionally, due to the complexity of the underlying neural models, testing machine translation systems presents new challenges.",1,0,0,0
1536,"To address this problem, we introduce a novel methodology called PatInv.",0,0,1,0
1537,The main intuition behind PatInv is that sentences with different meanings should not have the same translation.,0,0,1,0
1538,"Under this general idea, we provide two realizations of PatInv that given an arbitrary sentence, generate syntactically similar but semantically different sentences by: (1) replacing one word in the sentence using a masked language model or (2) removing one word or phrase from the sentence based on its constituency structure.",0,1,0,0
1539,We then test whether the returned translations are the same for the original and modified sentences.,0,1,0,0
1540,We have applied PatInv to test Google Translate and Bing Microsoft Translator using 200 English sentences.,0,1,0,0
1541,Two language settings are considered: English-Hindi (En-Hi) and English-Chinese (En-Zh).,0,1,0,0
1542,"The results show that PatInv can accurately find 308 erroneous translations in Google Translate and 223 erroneous translations in Bing Microsoft Translator, most of which cannot be found by the state-of-the-art approaches.",0,0,0,1
1543,"
Mutation testing research has often used the number of mutants as a surrogate measure for the true execution cost of generating and executing mutants.",1,0,0,0
1544,This poses a potential threat to the validity of the scientific findings reported in the literature.,1,0,0,0
1545,"Out of 75 works surveyed in this paper, we found that 54 (72%) are vulnerable to this threat.",0,1,0,1
1546,"To investigate the magnitude of the threat, we conducted an empirical evaluation using 10 real-world programs.",0,1,1,0
1547,"The results reveal that: i) percentages of randomly sampled mutants differ from the true execution time, on average, by 44%, varying in difference from 19% to 91%; ii) errors arising from using the surrogate correlate with program size (ρ = 0.74) and number of mutants (ρ = 0.76), making the problem more pernicious for more realistic programs; iii) scientific findings concerning sampling strategies would have approximately 37% rank disagreement, indicating potentially dramatic impact on experiment validity.",0,0,0,1
1548,"To investigate whether this threat matters in practice, we reproduced a seminal study on Selective Mutation (widely relied upon for more than two decades).",0,1,0,0
1549,The impact is stark: an inconclusive scientific finding using the surrogate is transformed to an unequivocal finding when using the true execution cost.,0,0,0,1
1550,"
Robots that support humans by performing useful tasks (a.k.a., service robots) are booming worldwide.",1,0,0,0
1551,"In contrast to industrial robots, the development of service robots comes with severe software engineering challenges, since they require high levels of robustness and autonomy to operate in highly heterogeneous environments.",1,0,0,0
1552,"As a domain with critical safety implications, service robotics faces a need for sound software development practices.",1,0,0,0
1553,"In this paper, we present the first large-scale empirical study to assess the state of the art and practice of robotics software engineering.",1,0,1,0
1554,We conducted 18 semi-structured interviews with industrial practitioners working in 15 companies from 9 different countries and a survey with 156 respondents from 26 countries from the robotics domain.,0,1,0,0
1555,"Our results provide a comprehensive picture of (i) the practices applied by robotics industrial and academic practitioners, including processes, paradigms, languages, tools, frameworks, and reuse practices, (ii) the distinguishing characteristics of robotics software engineering, and (iii) recurrent challenges usually faced, together with adopted solutions.",0,0,0,1
1556,"The paper concludes by discussing observations, derived hypotheses, and proposed actions for researchers and practitioners.",0,0,0,1
1557,"
Equivalence checking techniques help establish whether two versions of a program exhibit the same behavior.",1,0,0,0
1558,The majority of popular techniques for formally proving/refuting equivalence relies on symbolic execution – a static analysis approach that reasons about program behaviors in terms of symbolic input variables.,1,0,0,0
1559,"Yet, symbolic execution is difficult to scale in practice due to complex programming constructs, such as loops and non-linear arithmetic.",1,0,0,0
1560,"This paper proposes an approach, named ARDiff, for improving the scalability of symbolic-execution-based equivalence checking techniques when comparing syntactically-similar versions of a program, e.g., for verifying the correctness of code upgrades and refactoring.",0,0,1,0
1561,"Our approach relies on a set of novel heuristics to determine which parts of the versions’ common code can be effectively pruned during the analysis, reducing the analysis complexity without sacrificing its effectiveness.",0,1,0,0
1562,"Furthermore, we devise a new equivalence checking benchmark, extending existing benchmarks with a set of real-life methods containing complex math functions and loops.",0,1,0,0
1563,"We evaluate the effectiveness and efficiency of ARDiff on this benchmark and show that it outperforms existing method-level equivalence checking techniques by solving 86% of all equivalent and 55% of non-equivalent cases, compared with 47% to 69% for equivalent and 38% to 52% for non-equivalent cases in related work.",0,0,0,1
1564,"
In large-scale cloud systems, unplanned service interruptions and outages may cause severe degradation of service availability.",1,0,0,0
1565,"Such incidents can occur in a bursty manner, which will deteriorate user satisfaction.",1,0,0,0
1566,Identifying incidents rapidly and accurately is critical to the operation and maintenance of a cloud system.,1,0,0,0
1567,"In industrial practice, incidents are typically detected through analyzing the issue reports, which are generated over time by monitoring cloud services.",1,0,0,0
1568,Identifying incidents in a large number of issue reports is quite challenging.,1,0,0,0
1569,An issue report is typically multi-dimensional: it has many categorical attributes.,1,0,0,0
1570,It is difficult to identify a specific attribute combination that indicates an incident.,1,0,0,0
1571,"Existing methods generally rely on pruning-based search, which is time-consuming given high-dimensional data, thus not practical to incident detection in large-scale cloud systems.",1,0,0,0
1572,"In this paper, we propose MID (Multi-dimensional Incident Detection), a novel framework for identifying incidents from large-amount, multi-dimensional issue reports effectively and efficiently.",0,0,1,0
1573,Key to the MID design is encoding the problem into a combinatorial optimization problem.,0,1,0,0
1574,"Then a specific-tailored meta-heuristic search method is designed, which can rapidly identify attribute combinations that indicate incidents.",0,1,0,0
1575,We evaluate MID with extensive experiments using both synthetic data and real-world data collected from a large-scale production cloud system.,0,1,0,0
1576,The experimental results show that MID significantly outperforms the current state-of-the-art methods in terms of effectiveness and efficiency.,0,0,0,1
1577,"Additionally, MID has been successfully applied to Microsoft's cloud systems and helped greatly reduce manual maintenance effort.",0,0,0,1
1578,"
We present HOMI, a new technique to enhance symbolic execution by maintaining only a small number of promising states.",0,0,1,0
1579,"In practice, symbolic execution typically maintains as many states as possible in a fear of losing important states.",1,0,0,0
1580,"In this paper, however, we show that only a tiny subset of the states plays a significant role in increasing code coverage or reaching bug points.",0,0,0,1
1581,"Based on this observation, HOMI aims to minimize the total number of states while keeping “promising” states during symbolic execution.",0,1,0,0
1582,We identify promising states by a learning algorithm that continuously updates the probabilistic pruning strategy based on data accumulated during the testing process.,0,1,0,0
1583,Experimental results show that HOMI greatly increases code coverage and the ability to find bugs of KLEE on open-source C programs.,0,0,0,1
1584,"
Fuzz testing has been proved its effectiveness in discovering software vulnerabilities.",1,0,0,0
1585,"Empowered its randomness nature along with a coverage-guiding feature, fuzzing has been identified a vast number of vulnerabilities in real-world programs.",1,0,0,0
1586,This paper begins with an observation that the design of the current state-of-the-art fuzzers is not well suited for a particular (but yet important) set of software programs.,1,0,0,0
1587,"Specifically, current fuzzers have limitations in fuzzing programs serving multiple purposes, where each purpose is controlled by extra options.",1,0,0,0
1588,"This paper proposes CrFuzz, which overcomes this limitation.",0,0,1,0
1589,CrFuzz designs a clustering analysis to automatically predict if a newly given input would be accepted or not by a target program.,0,1,0,0
1590,"Exploiting this prediction capability, CrFuzz is designed to efficiently explore the programs with multiple purposes.",0,1,0,0
1591,"We employed CrFuzz for three state-of-the-art fuzzers, AFL, QSYM, and MOpt, and CrFuzz-augmented versions have shown 19.3% and 5.68% better path and edge coverage on average.",0,0,0,1
1592,"More importantly, during two weeks of long-running experiments, CrFuzz discovered 277 previously unknown vulnerabilities where 212 of those are already confirmed and fixed by the respected vendors.",0,0,0,1
1593,"We would like to emphasize that many of these vulnerabilities were discoverd from FFMpeg, ImageMagick, and Graphicsmagick, all of which are targets of Google's OSS-Fuzz project and thus heavily fuzzed for last three years by far.",0,0,0,1
1594,"Nevertheless, CrFuzz identified a remarkable number of vulnerabilities, demonstrating its effectiveness of vulnerability finding capability.",0,0,0,1
1595,"
In large-scale online service systems, incidents occur frequently due to a variety of causes, from updates of software and hardware to changes in operation environment.",1,0,0,0
1596,These incidents could significantly degrade system’s availability and customers’ satisfaction.,1,0,0,0
1597,Some incidents are linked because they are duplicate or inter-related.,1,0,0,0
1598,The linked incidents can greatly help on-call engineers find mitigation solutions and identify the root causes.,1,0,0,0
1599,"In this work, we investigate the incidents and their links in a representative real-world incident management (IcM) system.",0,0,1,0
1600,"Based on the identified indicators of linked incidents, we further propose LiDAR (Linked Incident identification with DAta-driven Representation), a deep learning based approach to incident linking.",0,0,1,0
1601,"More specifically, we incorporate the textual description of incidents and structural information extracted from historical linked incidents to identify possible links among a large number of incidents.",0,0,1,0
1602,"To show the effectiveness of our method, we apply our method to a real-world IcM system and find that our method outperforms other state-of-the-art methods.",0,1,0,0
1603,"
Recent effort to test deep learning systems has produced an intuitive and compelling test criterion called neuron coverage (NC), which resembles the notion of traditional code coverage.",1,0,0,0
1604,NC measures the proportion of neurons activated in a neural network and it is implicitly assumed that increasing NC improves the quality of a test suite.,1,0,0,0
1605,"In an attempt to automatically generate a test suite that increases NC, we design a novel diversity promoting regularizer that can be plugged into existing adversarial attack algorithms.",0,0,1,0
1606,"We then assess whether such attempts to increase NC could generate a test suite that (1) detects adversarial attacks successfully, (2) produces natural inputs, and (3) is unbiased to particular class predictions.",0,0,1,0
1607,"Contrary to expectation, our extensive evaluation finds that increasing NC actually makes it harder to generate an effective test suite: higher neuron coverage leads to fewer defects detected, less natural inputs, and more biased prediction preferences.",0,0,0,1
1608,"Our results invoke skepticism that increasing neuron coverage may not be a meaningful objective for generating tests for deep neural networks and call for a new test generation technique that considers defect detection, naturalness, and output impartiality in tandem.",0,0,0,1
1609,"
Smart contracts are computer programs allowing users to define and execute transactions automatically on top of the blockchain platform.",1,0,0,0
1610,Many of such smart contracts can be viewed as games.,1,0,0,0
1611,"A game-like contract accepts inputs from multiple participants, and upon ending, automatically derives an outcome while distributing assets according to some predefined rules.",1,0,0,0
1612,"Without clear understanding of the game rules, participants may suffer from fraudulent advertisements and financial losses.",1,0,0,0
1613,"In this paper, we present a framework to perform (semi-)automated verification of smart contract fairness, whose results can be used to refute false claims with concrete examples or certify contract implementations with respect to desired fairness properties.",0,0,1,0
1614,"We implement FairCon, which is able to check fairness properties including truthfulness, efficiency, optimality, and collusion-freeness for Ethereum smart contracts.",0,1,0,0
1615,We evaluate FairCon on a set of real-world benchmarks and the experiment result indicates that FairCon is effective in detecting property violations and able to prove fairness for common types of contracts.,0,1,0,1
1616,"
Exception handling is an effective mechanism to avoid unexpected runtime errors.",1,0,0,0
1617,"However, novice programmers might fail to handle exceptions properly, causing serious errors like system crashing or resource leaking.",1,0,0,0
1618,"In this paper, we introduce FuzzyCatch, a code recommendation tool for handling exceptions.",0,0,1,0
1619,"Based on fuzzy logic, FuzzyCatch can predict if a runtime exception would occur in a given code snippet and recommend code to handle that exception.",0,1,0,0
1620,FuzzyCatch is implemented as a plugin for Android Studio.,0,1,0,0
1621,The empirical evaluation suggests that FuzzyCatch is highly effective.,0,1,0,1
1622,"For example, it has top-1 accuracy of 77% on recommending what exception to catch in a try catch block and of 70% on recommending what method should be called when such an exception occurs.",0,0,0,1
1623,FuzzyCatch also achieves a high level of accuracy and outperforms baselines significantly on detecting and fixing real exception bugs.,0,0,0,1
1624,"
Software reuse lowers development costs and improves the quality of software systems.",1,0,0,0
1625,Two strategies are common: clone & own (copying and adapting a system) and platform-oriented reuse (building a configurable platform).,1,0,0,0
1626,"The former is readily available, flexible, and initially cheap, but does not scale with the frequency of reuse, imposing high maintenance costs.",1,0,0,0
1627,"The latter scales, but imposes high upfront investments for building the platform, and reduces flexibility.",1,0,0,0
1628,"As such, each strategy has distinctive advantages and disadvantages, imposing different development activities and software architectures.",1,0,0,0
1629,Deciding for one strategy is a core decision with long-term impact on an organization’s software development.,1,0,0,0
1630,"Unfortunately, the strategies’ costs are not well-understood - not surprisingly, given the lack of systematically elicited empirical data, which is difficult to collect.",1,0,0,0
1631,"We present an empirical study of the development activities, costs, cost factors, and benefits associated with either reuse strategy.",0,1,1,0
1632,"For this purpose, we combine quantitative and qualitative data that we triangulated from 26 interviews at a large organization and a systematic literature review covering 57 publications.",0,1,0,0
1633,Our study both confirms and refutes common hypotheses on software reuse.,0,0,0,1
1634,"For instance, we confirm that developing for platform-oriented reuse is more expensive, but simultaneously reduces reuse costs; and that platform-orientation results in higher code quality compared to clone & own.",0,0,0,1
1635,"Surprisingly, refuting common hypotheses, we find that change propagation can be more expensive in a platform, that platforms can facilitate the advancement into innovative markets, and that there is no strict distinction of clone & own and platform-oriented reuse in practice.",0,0,0,1
1636,"
A large percentage of real-world software configuration issues, such as misconfigurations, involve multiple interdependent configuration parameters.",1,0,0,0
1637,"However, existing techniques and tools either do not consider dependencies among configuration parameters— termed configuration dependencies—or rely on one or two dependency types and code patterns as input.",1,0,0,0
1638,"Without rigorous understanding of configuration dependencies, it is hard to deal with many resulting configuration issues.",1,0,0,0
1639,"This paper presents our study of software configuration dependencies in 16 widely-used cloud and datacenter systems, including dependencies within and across software components.",0,0,1,0
1640,"To understand types of configuration dependencies, we conduct an exhaustive search of descriptions in structured configuration metadata and unstructured user manuals.",0,1,0,0
1641,We find and manually analyze 521 configuration dependencies.,0,1,0,0
1642,We define five types of configuration dependencies and identify their common code patterns.,0,0,0,1
1643,We report on consequences of not satisfying these dependencies and current software engineering practices for handling the consequences.,0,0,0,1
1644,"We mechanize the knowledge gained from our study in a tool, cDep, which detects configuration dependencies.",0,0,0,1
1645,cDep automatically discovers five types of configuration dependencies from bytecode using static program analysis.,0,0,0,1
1646,We apply cDep to the eight Java and Scala software systems in our study.,0,1,0,0
1647,cDep finds 87.9% (275/313) of the related subset of dependencies from our study.,0,0,0,1
1648,"cDep also finds 448 previously undocumented dependencies, with a 6.0% average false positive rate.",0,0,0,1
1649,"Overall, our results show that configuration dependencies are more prevalent and diverse than previously reported and should henceforth be considered a first-class issue in software configuration engineering.",0,0,0,1
1650,"
Deep neural networks (DNNs) have been widely applied in the software development process to automatically learn patterns from massive data.",1,0,0,0
1651,"However, many applications still make decisions based on rules that are manually crafted and verified by domain experts due to safety or security concerns.",1,0,0,0
1652,"In this paper, we aim to close the gap between DNNs and rule-based systems by automating the rule generation process via extracting knowledge from well-trained DNNs.",0,0,1,0
1653,Existing techniques with similar purposes either rely on specific DNNs input instances or use inherently unstable random sampling of the input space.,1,0,0,0
1654,"Therefore, these approaches either limit the exploration area to a local decision-space of the DNNs or fail to converge to a consistent set of rules.",1,0,0,0
1655,The resulting rules thus lack representativeness and stability.,1,0,0,0
1656,"In this paper, we address the two aforementioned shortcomings by discovering a global property of the DNNs and use it to remodel the DNNs decision-boundary.",0,0,1,0
1657,"We name this property as the activation probability, and show that this property is stable.",0,0,0,1
1658,"With this insight, we propose an approach named DENAS including a novel rule-generation algorithm.",0,0,1,0
1659,Our proposed algorithm approximates the non-linear decision boundary of DNNs by iteratively superimposing a linearized optimization function.,0,0,1,0
1660,"We evaluate the representativeness, stability, and accuracy of DENAS against five state-of-the-art techniques (LEMNA, Gradient, IG, DeepTaylor, and DTExtract) on three software engineering and security applications: Binary analysis, PDF malware detection, and Android malware detection.",0,1,0,0
1661,Our results show that DENAS can generate more representative rules consistently in a more stable manner over other approaches.,0,0,0,1
1662,We further offer case studies that demonstrate the applications of DENAS such as debugging faults in the DNNs and generating signatures that can detect zero-day malware.,0,0,0,1
1663,"
We present a new framework and associated synthesis algorithms for program synthesis over noisy data, i.e., data that may contain incorrect/corrupted input-output examples.",0,0,1,0
1664,This framework is based on an extension of finite tree automata called state-weighted finite tree automata.,0,0,1,0
1665,We show how to apply this framework to formulate and solve a variety of program synthesis problems over noisy data.,0,1,0,0
1666,"Results from our implemented system running on problems from the SyGuS 2018 benchmark suite highlight its ability to successfully synthesize programs in the face of noisy data sets, including the ability to synthesize a correct program even when every input-output example in the data set is corrupted.",0,0,0,1
1667,"
The Intel Security Guard Extensions (SGX) architecture enables the abstraction of enclaved execution, using which an application can protect its code and data from powerful adversaries, including system software that executes with the highest processor privilege.",1,0,0,0
1668,"While the Intel SGX architecture exports an ISA with low-level instructions that enable applications to create enclaves, the task of writing applications using this ISA has been left to the software community.",1,0,0,0
1669,We consider the problem of porting legacy applications to SGX enclaves.,0,0,1,0
